Place,Lat,Population
", Cameron, Hidalgo, Willacy, Starr, Kenedy, Zapata, Brooks, Jim Hogg, Kleberg, Duval, Jim Wells, Nueces, Webb, San Patricio, Aransas",27.20180803,2196674
"Refugio, La Salle, Live Oak, McMullen, Bee, Dimmit, Calhoun, Goliad, Maverick, Victoria, Matagorda, Zavala, Frio, Atascosa, Karnes, Jackson, DeWitt, Wilson, Brazoria, Wharton, Kinney, Medina, Uvalde, Lavaca, Galveston, Bexar, Gonzales, Fort Bend, Guadalupe, Colorado, Chambers, Bandera, Comal, Brewster, Real, Caldwell, Harris, Fayette, Jefferson, Austin, Val Verde, Kendall, Edwards, Presidio, Waller, Hays, Kerr, Bastrop, Orange",29.34308172,10322015
"Liberty, Washington, Terrell, Blanco, Montgomery, Lee, Gillespie, Hardin, Travis, Kimble, Burleson, Sutton, Grimes, San Jacinto, Williamson, Brazos, Llano, Jeff Davis, Mason, Crockett, Walker, Jasper, Tyler, Pecos, Newton, Milam, Burnet, Polk, Menard, Schleicher, Madison, Robertson, Bell, Trinity, San Saba, McCulloch, Lampasas, Falls, Angelina, Leon, Irion, Houston, Reeves, Concho, Sabine, Reagan, Upton, Coryell, San Augustine, Tom Green, Crane, Culberson, Hudspeth, Mills, Ward, Limestone, McLennan, Nacogdoches, Freestone, Hamilton, Coleman, El Paso, Brown, Shelby, Anderson, Sterling, Runnels, Cherokee, Loving, Winkler, Ector, Midland, Glasscock, Coke, Bosque, Comanche, Hill, Navarro, Rusk",31.18087916,6204742
"Panola, Henderson, Somervell, Erath, Callahan, Taylor, Nolan, Andrews, Martin, Howard, Mitchell, Eastland, Ellis, Smith, Johnson, Hood, Gregg, Harrison, Van Zandt, Kaufman, Stephens, Shackelford, Upshur, Jones, Gaines, Dawson, Fisher, Borden, Scurry, Palo Pinto, Dallas, Tarrant, Parker, Wood, Marion, Rains, Rockwall, Camp, Cass, Morris, Hunt, Hopkins, Yoakum, Terry, Franklin, Lynn, Young, Throckmorton, Haskell, Stonewall, Garza, Kent, Collin, Denton, Titus, Wise, Jack, Delta, Bowie, Fannin, Cochran, Knox, Hockley, Lubbock, Crosby, Archer, Dickens, Baylor, King, Red River, Grayson, Cooke, Lamar, Montague, Clay, Foard, Wichita, Bailey, Lamb, Hale, Floyd, Motley, Cottle, Wilbarger",33.08078235,9997520
"Hardeman, Childress, Parmer, Castro, Briscoe, Swisher, Hall, Collingsworth, Armstrong, Donley, Deaf Smith, Randall, Gray, Wheeler, Potter, Carson, Oldham, Hemphill, Moore, Roberts, Hutchinson, Hartley",35.1136908,396298